{
  "$schema": "https://json-schema.org/draft/2020-12/schema",
  "$id": "https://hub.ndhu-ted/schema/site.schema.json",
  "title": "site.json — 全站設定",
  "type": "object",
  "additionalProperties": false,
  "required": ["brand", "baseUrl", "scoreUrl", "scoreDemoUrl", "about", "footerCredits", "buildLog"],
  "properties": {
    "brand": {
      "type": "object",
      "additionalProperties": false,
      "required": ["name", "semester", "description", "palette"],
      "properties": {
        "name": { "type": "string", "minLength": 1 },
        "semester": { "$ref": "_defs.schema.json#/$defs/semester" },
        "description": { "type": ["string", "null"] },
        "palette": {
          "type": "object",
          "additionalProperties": false,
          "required": ["teal", "gold", "cream", "ink"],
          "properties": {
            "teal": { "const": "#0E7C7B" },
            "gold": { "const": "#D9A441" },
            "cream": { "const": "#F4ECD8" },
            "ink": { "const": "#1A1A1A" }
          }
        }
      }
    },
    "baseUrl": { "$ref": "_defs.schema.json#/$defs/nullableHttpsUrl" },
    "scoreUrl": { "$ref": "_defs.schema.json#/$defs/scoreV2Url" },
    "scoreDemoUrl": { "$ref": "_defs.schema.json#/$defs/nullableHttpsUrl" },
    "weekOneStart": {
      "description": "第 1 週週一日期（YYYY-MM-DD；學期行事曆真值，115-1＝2026-09-07 全校開始上課）。null＝未定，課程頁「本週」高亮休眠（2026-07-05 學生視角升級）",
      "type": ["string", "null"],
      "format": "date"
    },
    "enrollUrl": {
      "description": "學校選課入口（教務處「選課常用系統」總覽頁）。null＝未定，課程頁不出「怎麼選課」chip",
      "$ref": "_defs.schema.json#/$defs/nullableHttpsUrl"
    },
    "about": {
      "type": "object",
      "additionalProperties": false,
      "required": ["name", "title", "email", "office", "contact"],
      "properties": {
        "name": { "type": "string", "minLength": 1 },
        "title": { "type": "string", "minLength": 1 },
        "email": { "type": "string", "format": "email" },
        "office": { "type": "string", "minLength": 1 },
        "contact": { "type": "string", "minLength": 1 },
        "contactNote": {
          "description": "聯絡方式下的回覆預期小字（降低學生催問焦慮；null／缺＝不出）。2026-07-05 學生視角升級",
          "type": ["string", "null"]
        }
      }
    },
    "footerCredits": { "type": "string", "minLength": 1 },
    "buildLog": {
      "type": "object",
      "additionalProperties": false,
      "required": ["enabled"],
      "properties": { "enabled": { "type": "boolean" } }
    },
    "i18n": {
      "$comment": "最小共用 chrome 字典（工單第 22 項）：只服務 115-1 課程頁的導覽／按鈕／狀態字，不是全站 i18n。實際必備鍵由 validate 規則 #20 的清單把關（fail-closed）。",
      "type": "object",
      "additionalProperties": false,
      "required": ["en"],
      "properties": {
        "$comment": { "type": "string" },
        "en": {
          "type": "object",
          "minProperties": 1,
          "additionalProperties": { "type": "string", "minLength": 1 }
        }
      }
    }
  }
}
